No.     Time           Source                Destination           Protocol Length Info
      1 0.000000       145.254.160.237       65.208.228.223        TCP      62     3372 → 80 [SYN] Seq=0 Win=8760 Len=0 MSS=1460 SACK_PERM=1

Frame 1: 62 bytes on wire (496 bits), 62 bytes captured (496 bits)
Ethernet II, Src: Xerox_00:00:00 (00:00:01:00:00:00), Dst: fe:ff:20:00:01:00 (fe:ff:20:00:01:00)
    Destination: fe:ff:20:00:01:00 (fe:ff:20:00:01:00)
    Source: Xerox_00:00:00 (00:00:01:00:00:00)
    Type: IPv4 (0x0800)
Internet Protocol Version 4, Src: 145.254.160.237, Dst: 65.208.228.223
Transmission Control Protocol, Src Port: 3372, Dst Port: 80, Seq: 0, Len: 0

No.     Time           Source                Destination           Protocol Length Info
      2 0.911310       65.208.228.223        145.254.160.237       TCP      62     80 → 3372 [SYN, ACK] Seq=0 Ack=1 Win=5840 Len=0 MSS=1380 SACK_PERM=1

Frame 2: 62 bytes on wire (496 bits), 62 bytes captured (496 bits)
Ethernet II, Src: fe:ff:20:00:01:00 (fe:ff:20:00:01:00), Dst: Xerox_00:00:00 (00:00:01:00:00:00)
    Destination: Xerox_00:00:00 (00:00:01:00:00:00)
    Source: fe:ff:20:00:01:00 (fe:ff:20:00:01:00)
    Type: IPv4 (0x0800)
Internet Protocol Version 4, Src: 65.208.228.223, Dst: 145.254.160.237
Transmission Control Protocol, Src Port: 80, Dst Port: 3372, Seq: 0, Ack: 1, Len: 0

No.     Time           Source                Destination           Protocol Length Info
      3 0.911310       145.254.160.237       65.208.228.223        TCP      54     3372 → 80 [ACK] Seq=1 Ack=1 Win=9660 Len=0

Frame 3: 54 bytes on wire (432 bits), 54 bytes captured (432 bits)
Ethernet II, Src: Xerox_00:00:00 (00:00:01:00:00:00), Dst: fe:ff:20:00:01:00 (fe:ff:20:00:01:00)
    Destination: fe:ff:20:00:01:00 (fe:ff:20:00:01:00)
    Source: Xerox_00:00:00 (00:00:01:00:00:00)
    Type: IPv4 (0x0800)
Internet Protocol Version 4, Src: 145.254.160.237, Dst: 65.208.228.223
Transmission Control Protocol, Src Port: 3372, Dst Port: 80, Seq: 1, Ack: 1, Len: 0

No.     Time           Source                Destination           Protocol Length Info
      4 0.911310       145.254.160.237       65.208.228.223        HTTP     533    GET /download.html HTTP/1.1 

Frame 4: 533 bytes on wire (4264 bits), 533 bytes captured (4264 bits)
Ethernet II, Src: Xerox_00:00:00 (00:00:01:00:00:00), Dst: fe:ff:20:00:01:00 (fe:ff:20:00:01:00)
    Destination: fe:ff:20:00:01:00 (fe:ff:20:00:01:00)
    Source: Xerox_00:00:00 (00:00:01:00:00:00)
    Type: IPv4 (0x0800)
Internet Protocol Version 4, Src: 145.254.160.237, Dst: 65.208.228.223
Transmission Control Protocol, Src Port: 3372, Dst Port: 80, Seq: 1, Ack: 1, Len: 479
Hypertext Transfer Protocol

No.     Time           Source                Destination           Protocol Length Info
      5 1.472116       65.208.228.223        145.254.160.237       TCP      54     80 → 3372 [ACK] Seq=1 Ack=480 Win=6432 Len=0

Frame 5: 54 bytes on wire (432 bits), 54 bytes captured (432 bits)
Ethernet II, Src: fe:ff:20:00:01:00 (fe:ff:20:00:01:00), Dst: Xerox_00:00:00 (00:00:01:00:00:00)
    Destination: Xerox_00:00:00 (00:00:01:00:00:00)
    Source: fe:ff:20:00:01:00 (fe:ff:20:00:01:00)
    Type: IPv4 (0x0800)
Internet Protocol Version 4, Src: 65.208.228.223, Dst: 145.254.160.237
Transmission Control Protocol, Src Port: 80, Dst Port: 3372, Seq: 1, Ack: 480, Len: 0

No.     Time           Source                Destination           Protocol Length Info
      6 1.682419       65.208.228.223        145.254.160.237       TCP      1434   80 → 3372 [ACK] Seq=1 Ack=480 Win=6432 Len=1380 [TCP segment of a reassembled PDU]

Frame 6: 1434 bytes on wire (11472 bits), 1434 bytes captured (11472 bits)
Ethernet II, Src: fe:ff:20:00:01:00 (fe:ff:20:00:01:00), Dst: Xerox_00:00:00 (00:00:01:00:00:00)
    Destination: Xerox_00:00:00 (00:00:01:00:00:00)
    Source: fe:ff:20:00:01:00 (fe:ff:20:00:01:00)
    Type: IPv4 (0x0800)
Internet Protocol Version 4, Src: 65.208.228.223, Dst: 145.254.160.237
Transmission Control Protocol, Src Port: 80, Dst Port: 3372, Seq: 1, Ack: 480, Len: 1380

No.     Time           Source                Destination           Protocol Length Info
      7 1.812606       145.254.160.237       65.208.228.223        TCP      54     3372 → 80 [ACK] Seq=480 Ack=1381 Win=9660 Len=0

Frame 7: 54 bytes on wire (432 bits), 54 bytes captured (432 bits)
Ethernet II, Src: Xerox_00:00:00 (00:00:01:00:00:00), Dst: fe:ff:20:00:01:00 (fe:ff:20:00:01:00)
    Destination: fe:ff:20:00:01:00 (fe:ff:20:00:01:00)
    Source: Xerox_00:00:00 (00:00:01:00:00:00)
    Type: IPv4 (0x0800)
Internet Protocol Version 4, Src: 145.254.160.237, Dst: 65.208.228.223
Transmission Control Protocol, Src Port: 3372, Dst Port: 80, Seq: 480, Ack: 1381, Len: 0

No.     Time           Source                Destination           Protocol Length Info
      8 1.812606       65.208.228.223        145.254.160.237       TCP      1434   80 → 3372 [ACK] Seq=1381 Ack=480 Win=6432 Len=1380 [TCP segment of a reassembled PDU]

Frame 8: 1434 bytes on wire (11472 bits), 1434 bytes captured (11472 bits)
Ethernet II, Src: fe:ff:20:00:01:00 (fe:ff:20:00:01:00), Dst: Xerox_00:00:00 (00:00:01:00:00:00)
    Destination: Xerox_00:00:00 (00:00:01:00:00:00)
    Source: fe:ff:20:00:01:00 (fe:ff:20:00:01:00)
    Type: IPv4 (0x0800)
Internet Protocol Version 4, Src: 65.208.228.223, Dst: 145.254.160.237
Transmission Control Protocol, Src Port: 80, Dst Port: 3372, Seq: 1381, Ack: 480, Len: 1380

No.     Time           Source                Destination           Protocol Length Info
      9 2.012894       145.254.160.237       65.208.228.223        TCP      54     3372 → 80 [ACK] Seq=480 Ack=2761 Win=9660 Len=0

Frame 9: 54 bytes on wire (432 bits), 54 bytes captured (432 bits)
Ethernet II, Src: Xerox_00:00:00 (00:00:01:00:00:00), Dst: fe:ff:20:00:01:00 (fe:ff:20:00:01:00)
    Destination: fe:ff:20:00:01:00 (fe:ff:20:00:01:00)
    Source: Xerox_00:00:00 (00:00:01:00:00:00)
    Type: IPv4 (0x0800)
Internet Protocol Version 4, Src: 145.254.160.237, Dst: 65.208.228.223
Transmission Control Protocol, Src Port: 3372, Dst Port: 80, Seq: 480, Ack: 2761, Len: 0

No.     Time           Source                Destination           Protocol Length Info
     10 2.443513       65.208.228.223        145.254.160.237       TCP      1434   80 → 3372 [ACK] Seq=2761 Ack=480 Win=6432 Len=1380 [TCP segment of a reassembled PDU]

Frame 10: 1434 bytes on wire (11472 bits), 1434 bytes captured (11472 bits)
Ethernet II, Src: fe:ff:20:00:01:00 (fe:ff:20:00:01:00), Dst: Xerox_00:00:00 (00:00:01:00:00:00)
    Destination: Xerox_00:00:00 (00:00:01:00:00:00)
    Source: fe:ff:20:00:01:00 (fe:ff:20:00:01:00)
    Type: IPv4 (0x0800)
Internet Protocol Version 4, Src: 65.208.228.223, Dst: 145.254.160.237
Transmission Control Protocol, Src Port: 80, Dst Port: 3372, Seq: 2761, Ack: 480, Len: 1380

No.     Time           Source                Destination           Protocol Length Info
     11 2.553672       65.208.228.223        145.254.160.237       TCP      1434   80 → 3372 [PSH, ACK] Seq=4141 Ack=480 Win=6432 Len=1380 [TCP segment of a reassembled PDU]

Frame 11: 1434 bytes on wire (11472 bits), 1434 bytes captured (11472 bits)
Ethernet II, Src: fe:ff:20:00:01:00 (fe:ff:20:00:01:00), Dst: Xerox_00:00:00 (00:00:01:00:00:00)
    Destination: Xerox_00:00:00 (00:00:01:00:00:00)
    Source: fe:ff:20:00:01:00 (fe:ff:20:00:01:00)
    Type: IPv4 (0x0800)
Internet Protocol Version 4, Src: 65.208.228.223, Dst: 145.254.160.237
Transmission Control Protocol, Src Port: 80, Dst Port: 3372, Seq: 4141, Ack: 480, Len: 1380

No.     Time           Source                Destination           Protocol Length Info
     12 2.553672       145.254.160.237       65.208.228.223        TCP      54     3372 → 80 [ACK] Seq=480 Ack=5521 Win=9660 Len=0

Frame 12: 54 bytes on wire (432 bits), 54 bytes captured (432 bits)
Ethernet II, Src: Xerox_00:00:00 (00:00:01:00:00:00), Dst: fe:ff:20:00:01:00 (fe:ff:20:00:01:00)
    Destination: fe:ff:20:00:01:00 (fe:ff:20:00:01:00)
    Source: Xerox_00:00:00 (00:00:01:00:00:00)
    Type: IPv4 (0x0800)
Internet Protocol Version 4, Src: 145.254.160.237, Dst: 65.208.228.223
Transmission Control Protocol, Src Port: 3372, Dst Port: 80, Seq: 480, Ack: 5521, Len: 0

No.     Time           Source                Destination           Protocol Length Info
     14 2.633787       65.208.228.223        145.254.160.237       TCP      1434   80 → 3372 [ACK] Seq=5521 Ack=480 Win=6432 Len=1380 [TCP segment of a reassembled PDU]

Frame 14: 1434 bytes on wire (11472 bits), 1434 bytes captured (11472 bits)
Ethernet II, Src: fe:ff:20:00:01:00 (fe:ff:20:00:01:00), Dst: Xerox_00:00:00 (00:00:01:00:00:00)
    Destination: Xerox_00:00:00 (00:00:01:00:00:00)
    Source: fe:ff:20:00:01:00 (fe:ff:20:00:01:00)
    Type: IPv4 (0x0800)
Internet Protocol Version 4, Src: 65.208.228.223, Dst: 145.254.160.237
Transmission Control Protocol, Src Port: 80, Dst Port: 3372, Seq: 5521, Ack: 480, Len: 1380

No.     Time           Source                Destination           Protocol Length Info
     15 2.814046       145.254.160.237       65.208.228.223        TCP      54     3372 → 80 [ACK] Seq=480 Ack=6901 Win=9660 Len=0

Frame 15: 54 bytes on wire (432 bits), 54 bytes captured (432 bits)
Ethernet II, Src: Xerox_00:00:00 (00:00:01:00:00:00), Dst: fe:ff:20:00:01:00 (fe:ff:20:00:01:00)
    Destination: fe:ff:20:00:01:00 (fe:ff:20:00:01:00)
    Source: Xerox_00:00:00 (00:00:01:00:00:00)
    Type: IPv4 (0x0800)
Internet Protocol Version 4, Src: 145.254.160.237, Dst: 65.208.228.223
Transmission Control Protocol, Src Port: 3372, Dst Port: 80, Seq: 480, Ack: 6901, Len: 0

No.     Time           Source                Destination           Protocol Length Info
     16 2.894161       65.208.228.223        145.254.160.237       TCP      1434   80 → 3372 [ACK] Seq=6901 Ack=480 Win=6432 Len=1380 [TCP segment of a reassembled PDU]

Frame 16: 1434 bytes on wire (11472 bits), 1434 bytes captured (11472 bits)
Ethernet II, Src: fe:ff:20:00:01:00 (fe:ff:20:00:01:00), Dst: Xerox_00:00:00 (00:00:01:00:00:00)
    Destination: Xerox_00:00:00 (00:00:01:00:00:00)
    Source: fe:ff:20:00:01:00 (fe:ff:20:00:01:00)
    Type: IPv4 (0x0800)
Internet Protocol Version 4, Src: 65.208.228.223, Dst: 145.254.160.237
Transmission Control Protocol, Src Port: 80, Dst Port: 3372, Seq: 6901, Ack: 480, Len: 1380

No.     Time           Source                Destination           Protocol Length Info
     18 2.984291       145.254.160.237       216.239.59.99         HTTP     775    GET /pagead/ads?client=ca-pub-2309191948673629&random=1084443430285&lmt=1082467020&format=468x60_as&output=html&url=http%3A%2F%2Fwww.ethereal.com%2Fdownload.html&color_bg=FFFFFF&color_text=333333&color_link=000000&color_url=666633&color_border=666633 HTTP/1.1 

Frame 18: 775 bytes on wire (6200 bits), 775 bytes captured (6200 bits)
Ethernet II, Src: Xerox_00:00:00 (00:00:01:00:00:00), Dst: fe:ff:20:00:01:00 (fe:ff:20:00:01:00)
    Destination: fe:ff:20:00:01:00 (fe:ff:20:00:01:00)
    Source: Xerox_00:00:00 (00:00:01:00:00:00)
    Type: IPv4 (0x0800)
Internet Protocol Version 4, Src: 145.254.160.237, Dst: 216.239.59.99
Transmission Control Protocol, Src Port: 3371, Dst Port: 80, Seq: 1, Ack: 1, Len: 721
Hypertext Transfer Protocol

No.     Time           Source                Destination           Protocol Length Info
     19 3.014334       145.254.160.237       65.208.228.223        TCP      54     3372 → 80 [ACK] Seq=480 Ack=8281 Win=9660 Len=0

Frame 19: 54 bytes on wire (432 bits), 54 bytes captured (432 bits)
Ethernet II, Src: Xerox_00:00:00 (00:00:01:00:00:00), Dst: fe:ff:20:00:01:00 (fe:ff:20:00:01:00)
    Destination: fe:ff:20:00:01:00 (fe:ff:20:00:01:00)
    Source: Xerox_00:00:00 (00:00:01:00:00:00)
    Type: IPv4 (0x0800)
Internet Protocol Version 4, Src: 145.254.160.237, Dst: 65.208.228.223
Transmission Control Protocol, Src Port: 3372, Dst Port: 80, Seq: 480, Ack: 8281, Len: 0

No.     Time           Source                Destination           Protocol Length Info
     20 3.374852       65.208.228.223        145.254.160.237       TCP      1434   80 → 3372 [ACK] Seq=8281 Ack=480 Win=6432 Len=1380 [TCP segment of a reassembled PDU]

Frame 20: 1434 bytes on wire (11472 bits), 1434 bytes captured (11472 bits)
Ethernet II, Src: fe:ff:20:00:01:00 (fe:ff:20:00:01:00), Dst: Xerox_00:00:00 (00:00:01:00:00:00)
    Destination: Xerox_00:00:00 (00:00:01:00:00:00)
    Source: fe:ff:20:00:01:00 (fe:ff:20:00:01:00)
    Type: IPv4 (0x0800)
Internet Protocol Version 4, Src: 65.208.228.223, Dst: 145.254.160.237
Transmission Control Protocol, Src Port: 80, Dst Port: 3372, Seq: 8281, Ack: 480, Len: 1380

No.     Time           Source                Destination           Protocol Length Info
     21 3.495025       65.208.228.223        145.254.160.237       TCP      1434   80 → 3372 [PSH, ACK] Seq=9661 Ack=480 Win=6432 Len=1380 [TCP segment of a reassembled PDU]

Frame 21: 1434 bytes on wire (11472 bits), 1434 bytes captured (11472 bits)
Ethernet II, Src: fe:ff:20:00:01:00 (fe:ff:20:00:01:00), Dst: Xerox_00:00:00 (00:00:01:00:00:00)
    Destination: Xerox_00:00:00 (00:00:01:00:00:00)
    Source: fe:ff:20:00:01:00 (fe:ff:20:00:01:00)
    Type: IPv4 (0x0800)
Internet Protocol Version 4, Src: 65.208.228.223, Dst: 145.254.160.237
Transmission Control Protocol, Src Port: 80, Dst Port: 3372, Seq: 9661, Ack: 480, Len: 1380

No.     Time           Source                Destination           Protocol Length Info
     22 3.495025       145.254.160.237       65.208.228.223        TCP      54     3372 → 80 [ACK] Seq=480 Ack=11041 Win=9660 Len=0

Frame 22: 54 bytes on wire (432 bits), 54 bytes captured (432 bits)
Ethernet II, Src: Xerox_00:00:00 (00:00:01:00:00:00), Dst: fe:ff:20:00:01:00 (fe:ff:20:00:01:00)
    Destination: fe:ff:20:00:01:00 (fe:ff:20:00:01:00)
    Source: Xerox_00:00:00 (00:00:01:00:00:00)
    Type: IPv4 (0x0800)
Internet Protocol Version 4, Src: 145.254.160.237, Dst: 65.208.228.223
Transmission Control Protocol, Src Port: 3372, Dst Port: 80, Seq: 480, Ack: 11041, Len: 0

No.     Time           Source                Destination           Protocol Length Info
     23 3.635227       65.208.228.223        145.254.160.237       TCP      1434   80 → 3372 [ACK] Seq=11041 Ack=480 Win=6432 Len=1380 [TCP segment of a reassembled PDU]

Frame 23: 1434 bytes on wire (11472 bits), 1434 bytes captured (11472 bits)
Ethernet II, Src: fe:ff:20:00:01:00 (fe:ff:20:00:01:00), Dst: Xerox_00:00:00 (00:00:01:00:00:00)
    Destination: Xerox_00:00:00 (00:00:01:00:00:00)
    Source: fe:ff:20:00:01:00 (fe:ff:20:00:01:00)
    Type: IPv4 (0x0800)
Internet Protocol Version 4, Src: 65.208.228.223, Dst: 145.254.160.237
Transmission Control Protocol, Src Port: 80, Dst Port: 3372, Seq: 11041, Ack: 480, Len: 1380

No.     Time           Source                Destination           Protocol Length Info
     24 3.645241       216.239.59.99         145.254.160.237       TCP      54     80 → 3371 [ACK] Seq=1 Ack=722 Win=31460 Len=0

Frame 24: 54 bytes on wire (432 bits), 54 bytes captured (432 bits)
Ethernet II, Src: fe:ff:20:00:01:00 (fe:ff:20:00:01:00), Dst: Xerox_00:00:00 (00:00:01:00:00:00)
    Destination: Xerox_00:00:00 (00:00:01:00:00:00)
    Source: fe:ff:20:00:01:00 (fe:ff:20:00:01:00)
    Type: IPv4 (0x0800)
Internet Protocol Version 4, Src: 216.239.59.99, Dst: 145.254.160.237
Transmission Control Protocol, Src Port: 80, Dst Port: 3371, Seq: 1, Ack: 722, Len: 0

No.     Time           Source                Destination           Protocol Length Info
     25 3.815486       145.254.160.237       65.208.228.223        TCP      54     3372 → 80 [ACK] Seq=480 Ack=12421 Win=9660 Len=0

Frame 25: 54 bytes on wire (432 bits), 54 bytes captured (432 bits)
Ethernet II, Src: Xerox_00:00:00 (00:00:01:00:00:00), Dst: fe:ff:20:00:01:00 (fe:ff:20:00:01:00)
    Destination: fe:ff:20:00:01:00 (fe:ff:20:00:01:00)
    Source: Xerox_00:00:00 (00:00:01:00:00:00)
    Type: IPv4 (0x0800)
Internet Protocol Version 4, Src: 145.254.160.237, Dst: 65.208.228.223
Transmission Control Protocol, Src Port: 3372, Dst Port: 80, Seq: 480, Ack: 12421, Len: 0

No.     Time           Source                Destination           Protocol Length Info
     26 3.915630       216.239.59.99         145.254.160.237       TCP      1484   80 → 3371 [PSH, ACK] Seq=1 Ack=722 Win=31460 Len=1430 [TCP segment of a reassembled PDU]

Frame 26: 1484 bytes on wire (11872 bits), 1484 bytes captured (11872 bits)
Ethernet II, Src: fe:ff:20:00:01:00 (fe:ff:20:00:01:00), Dst: Xerox_00:00:00 (00:00:01:00:00:00)
    Destination: Xerox_00:00:00 (00:00:01:00:00:00)
    Source: fe:ff:20:00:01:00 (fe:ff:20:00:01:00)
    Type: IPv4 (0x0800)
Internet Protocol Version 4, Src: 216.239.59.99, Dst: 145.254.160.237
Transmission Control Protocol, Src Port: 80, Dst Port: 3371, Seq: 1, Ack: 722, Len: 1430

No.     Time           Source                Destination           Protocol Length Info
     27 3.955688       216.239.59.99         145.254.160.237       HTTP     214    HTTP/1.1 200 OK  (text/html)

Frame 27: 214 bytes on wire (1712 bits), 214 bytes captured (1712 bits)
Ethernet II, Src: fe:ff:20:00:01:00 (fe:ff:20:00:01:00), Dst: Xerox_00:00:00 (00:00:01:00:00:00)
    Destination: Xerox_00:00:00 (00:00:01:00:00:00)
    Source: fe:ff:20:00:01:00 (fe:ff:20:00:01:00)
    Type: IPv4 (0x0800)
Internet Protocol Version 4, Src: 216.239.59.99, Dst: 145.254.160.237
Transmission Control Protocol, Src Port: 80, Dst Port: 3371, Seq: 1431, Ack: 722, Len: 160
[2 Reassembled TCP Segments (1590 bytes): #26(1430), #27(160)]
Hypertext Transfer Protocol
Line-based text data: text/html (3 lines)

No.     Time           Source                Destination           Protocol Length Info
     28 3.955688       145.254.160.237       216.239.59.99         TCP      54     3371 → 80 [ACK] Seq=722 Ack=1591 Win=8760 Len=0

Frame 28: 54 bytes on wire (432 bits), 54 bytes captured (432 bits)
Ethernet II, Src: Xerox_00:00:00 (00:00:01:00:00:00), Dst: fe:ff:20:00:01:00 (fe:ff:20:00:01:00)
    Destination: fe:ff:20:00:01:00 (fe:ff:20:00:01:00)
    Source: Xerox_00:00:00 (00:00:01:00:00:00)
    Type: IPv4 (0x0800)
Internet Protocol Version 4, Src: 145.254.160.237, Dst: 216.239.59.99
Transmission Control Protocol, Src Port: 3371, Dst Port: 80, Seq: 722, Ack: 1591, Len: 0

No.     Time           Source                Destination           Protocol Length Info
     29 4.105904       65.208.228.223        145.254.160.237       TCP      1434   80 → 3372 [PSH, ACK] Seq=12421 Ack=480 Win=6432 Len=1380 [TCP segment of a reassembled PDU]

Frame 29: 1434 bytes on wire (11472 bits), 1434 bytes captured (11472 bits)
Ethernet II, Src: fe:ff:20:00:01:00 (fe:ff:20:00:01:00), Dst: Xerox_00:00:00 (00:00:01:00:00:00)
    Destination: Xerox_00:00:00 (00:00:01:00:00:00)
    Source: fe:ff:20:00:01:00 (fe:ff:20:00:01:00)
    Type: IPv4 (0x0800)
Internet Protocol Version 4, Src: 65.208.228.223, Dst: 145.254.160.237
Transmission Control Protocol, Src Port: 80, Dst Port: 3372, Seq: 12421, Ack: 480, Len: 1380

No.     Time           Source                Destination           Protocol Length Info
     30 4.216062       145.254.160.237       65.208.228.223        TCP      54     3372 → 80 [ACK] Seq=480 Ack=13801 Win=9660 Len=0

Frame 30: 54 bytes on wire (432 bits), 54 bytes captured (432 bits)
Ethernet II, Src: Xerox_00:00:00 (00:00:01:00:00:00), Dst: fe:ff:20:00:01:00 (fe:ff:20:00:01:00)
    Destination: fe:ff:20:00:01:00 (fe:ff:20:00:01:00)
    Source: Xerox_00:00:00 (00:00:01:00:00:00)
    Type: IPv4 (0x0800)
Internet Protocol Version 4, Src: 145.254.160.237, Dst: 65.208.228.223
Transmission Control Protocol, Src Port: 3372, Dst Port: 80, Seq: 480, Ack: 13801, Len: 0

No.     Time           Source                Destination           Protocol Length Info
     31 4.226076       65.208.228.223        145.254.160.237       TCP      1434   80 → 3372 [ACK] Seq=13801 Ack=480 Win=6432 Len=1380 [TCP segment of a reassembled PDU]

Frame 31: 1434 bytes on wire (11472 bits), 1434 bytes captured (11472 bits)
Ethernet II, Src: fe:ff:20:00:01:00 (fe:ff:20:00:01:00), Dst: Xerox_00:00:00 (00:00:01:00:00:00)
    Destination: Xerox_00:00:00 (00:00:01:00:00:00)
    Source: fe:ff:20:00:01:00 (fe:ff:20:00:01:00)
    Type: IPv4 (0x0800)
Internet Protocol Version 4, Src: 65.208.228.223, Dst: 145.254.160.237
Transmission Control Protocol, Src Port: 80, Dst Port: 3372, Seq: 13801, Ack: 480, Len: 1380

No.     Time           Source                Destination           Protocol Length Info
     32 4.356264       65.208.228.223        145.254.160.237       TCP      1434   80 → 3372 [ACK] Seq=15181 Ack=480 Win=6432 Len=1380 [TCP segment of a reassembled PDU]

Frame 32: 1434 bytes on wire (11472 bits), 1434 bytes captured (11472 bits)
Ethernet II, Src: fe:ff:20:00:01:00 (fe:ff:20:00:01:00), Dst: Xerox_00:00:00 (00:00:01:00:00:00)
    Destination: Xerox_00:00:00 (00:00:01:00:00:00)
    Source: fe:ff:20:00:01:00 (fe:ff:20:00:01:00)
    Type: IPv4 (0x0800)
Internet Protocol Version 4, Src: 65.208.228.223, Dst: 145.254.160.237
Transmission Control Protocol, Src Port: 80, Dst Port: 3372, Seq: 15181, Ack: 480, Len: 1380

No.     Time           Source                Destination           Protocol Length Info
     33 4.356264       145.254.160.237       65.208.228.223        TCP      54     3372 → 80 [ACK] Seq=480 Ack=16561 Win=9660 Len=0

Frame 33: 54 bytes on wire (432 bits), 54 bytes captured (432 bits)
Ethernet II, Src: Xerox_00:00:00 (00:00:01:00:00:00), Dst: fe:ff:20:00:01:00 (fe:ff:20:00:01:00)
    Destination: fe:ff:20:00:01:00 (fe:ff:20:00:01:00)
    Source: Xerox_00:00:00 (00:00:01:00:00:00)
    Type: IPv4 (0x0800)
Internet Protocol Version 4, Src: 145.254.160.237, Dst: 65.208.228.223
Transmission Control Protocol, Src Port: 3372, Dst Port: 80, Seq: 480, Ack: 16561, Len: 0

No.     Time           Source                Destination           Protocol Length Info
     34 4.496465       65.208.228.223        145.254.160.237       TCP      1434   80 → 3372 [ACK] Seq=16561 Ack=480 Win=6432 Len=1380 [TCP segment of a reassembled PDU]

Frame 34: 1434 bytes on wire (11472 bits), 1434 bytes captured (11472 bits)
Ethernet II, Src: fe:ff:20:00:01:00 (fe:ff:20:00:01:00), Dst: Xerox_00:00:00 (00:00:01:00:00:00)
    Destination: Xerox_00:00:00 (00:00:01:00:00:00)
    Source: fe:ff:20:00:01:00 (fe:ff:20:00:01:00)
    Type: IPv4 (0x0800)
Internet Protocol Version 4, Src: 65.208.228.223, Dst: 145.254.160.237
Transmission Control Protocol, Src Port: 80, Dst Port: 3372, Seq: 16561, Ack: 480, Len: 1380

No.     Time           Source                Destination           Protocol Length Info
     35 4.496465       145.254.160.237       65.208.228.223        TCP      54     3372 → 80 [ACK] Seq=480 Ack=17941 Win=9660 Len=0

Frame 35: 54 bytes on wire (432 bits), 54 bytes captured (432 bits)
Ethernet II, Src: Xerox_00:00:00 (00:00:01:00:00:00), Dst: fe:ff:20:00:01:00 (fe:ff:20:00:01:00)
    Destination: fe:ff:20:00:01:00 (fe:ff:20:00:01:00)
    Source: Xerox_00:00:00 (00:00:01:00:00:00)
    Type: IPv4 (0x0800)
Internet Protocol Version 4, Src: 145.254.160.237, Dst: 65.208.228.223
Transmission Control Protocol, Src Port: 3372, Dst Port: 80, Seq: 480, Ack: 17941, Len: 0

No.     Time           Source                Destination           Protocol Length Info
     36 4.776868       216.239.59.99         145.254.160.237       TCP      1484   [TCP Spurious Retransmission] 80 → 3371 [PSH, ACK] Seq=1 Ack=722 Win=31460 Len=1430

Frame 36: 1484 bytes on wire (11872 bits), 1484 bytes captured (11872 bits)
Ethernet II, Src: fe:ff:20:00:01:00 (fe:ff:20:00:01:00), Dst: Xerox_00:00:00 (00:00:01:00:00:00)
    Destination: Xerox_00:00:00 (00:00:01:00:00:00)
    Source: fe:ff:20:00:01:00 (fe:ff:20:00:01:00)
    Type: IPv4 (0x0800)
Internet Protocol Version 4, Src: 216.239.59.99, Dst: 145.254.160.237
Transmission Control Protocol, Src Port: 80, Dst Port: 3371, Seq: 1, Ack: 722, Len: 1430

No.     Time           Source                Destination           Protocol Length Info
     37 4.776868       145.254.160.237       216.239.59.99         TCP      54     [TCP Dup ACK 28#1] 3371 → 80 [ACK] Seq=722 Ack=1591 Win=8760 Len=0

Frame 37: 54 bytes on wire (432 bits), 54 bytes captured (432 bits)
Ethernet II, Src: Xerox_00:00:00 (00:00:01:00:00:00), Dst: fe:ff:20:00:01:00 (fe:ff:20:00:01:00)
    Destination: fe:ff:20:00:01:00 (fe:ff:20:00:01:00)
    Source: Xerox_00:00:00 (00:00:01:00:00:00)
    Type: IPv4 (0x0800)
Internet Protocol Version 4, Src: 145.254.160.237, Dst: 216.239.59.99
Transmission Control Protocol, Src Port: 3371, Dst Port: 80, Seq: 722, Ack: 1591, Len: 0

No.     Time           Source                Destination           Protocol Length Info
     38 4.846969       65.208.228.223        145.254.160.237       HTTP/XML 478    HTTP/1.1 200 OK 

Frame 38: 478 bytes on wire (3824 bits), 478 bytes captured (3824 bits)
Ethernet II, Src: fe:ff:20:00:01:00 (fe:ff:20:00:01:00), Dst: Xerox_00:00:00 (00:00:01:00:00:00)
    Destination: Xerox_00:00:00 (00:00:01:00:00:00)
    Source: fe:ff:20:00:01:00 (fe:ff:20:00:01:00)
    Type: IPv4 (0x0800)
Internet Protocol Version 4, Src: 65.208.228.223, Dst: 145.254.160.237
Transmission Control Protocol, Src Port: 80, Dst Port: 3372, Seq: 17941, Ack: 480, Len: 424
[14 Reassembled TCP Segments (18364 bytes): #6(1380), #8(1380), #10(1380), #11(1380), #14(1380), #16(1380), #20(1380), #21(1380), #23(1380), #29(1380), #31(1380), #32(1380), #34(1380), #38(424)]
Hypertext Transfer Protocol
eXtensible Markup Language

No.     Time           Source                Destination           Protocol Length Info
     39 5.017214       145.254.160.237       65.208.228.223        TCP      54     3372 → 80 [ACK] Seq=480 Ack=18365 Win=9236 Len=0

Frame 39: 54 bytes on wire (432 bits), 54 bytes captured (432 bits)
Ethernet II, Src: Xerox_00:00:00 (00:00:01:00:00:00), Dst: fe:ff:20:00:01:00 (fe:ff:20:00:01:00)
    Destination: fe:ff:20:00:01:00 (fe:ff:20:00:01:00)
    Source: Xerox_00:00:00 (00:00:01:00:00:00)
    Type: IPv4 (0x0800)
Internet Protocol Version 4, Src: 145.254.160.237, Dst: 65.208.228.223
Transmission Control Protocol, Src Port: 3372, Dst Port: 80, Seq: 480, Ack: 18365, Len: 0

No.     Time           Source                Destination           Protocol Length Info
     40 17.905747      65.208.228.223        145.254.160.237       TCP      54     80 → 3372 [FIN, ACK] Seq=18365 Ack=480 Win=6432 Len=0

Frame 40: 54 bytes on wire (432 bits), 54 bytes captured (432 bits)
Ethernet II, Src: fe:ff:20:00:01:00 (fe:ff:20:00:01:00), Dst: Xerox_00:00:00 (00:00:01:00:00:00)
    Destination: Xerox_00:00:00 (00:00:01:00:00:00)
    Source: fe:ff:20:00:01:00 (fe:ff:20:00:01:00)
    Type: IPv4 (0x0800)
Internet Protocol Version 4, Src: 65.208.228.223, Dst: 145.254.160.237
Transmission Control Protocol, Src Port: 80, Dst Port: 3372, Seq: 18365, Ack: 480, Len: 0

No.     Time           Source                Destination           Protocol Length Info
     41 17.905747      145.254.160.237       65.208.228.223        TCP      54     3372 → 80 [ACK] Seq=480 Ack=18366 Win=9236 Len=0

Frame 41: 54 bytes on wire (432 bits), 54 bytes captured (432 bits)
Ethernet II, Src: Xerox_00:00:00 (00:00:01:00:00:00), Dst: fe:ff:20:00:01:00 (fe:ff:20:00:01:00)
    Destination: fe:ff:20:00:01:00 (fe:ff:20:00:01:00)
    Source: Xerox_00:00:00 (00:00:01:00:00:00)
    Type: IPv4 (0x0800)
Internet Protocol Version 4, Src: 145.254.160.237, Dst: 65.208.228.223
Transmission Control Protocol, Src Port: 3372, Dst Port: 80, Seq: 480, Ack: 18366, Len: 0

No.     Time           Source                Destination           Protocol Length Info
     42 30.063228      145.254.160.237       65.208.228.223        TCP      54     3372 → 80 [FIN, ACK] Seq=480 Ack=18366 Win=9236 Len=0

Frame 42: 54 bytes on wire (432 bits), 54 bytes captured (432 bits)
Ethernet II, Src: Xerox_00:00:00 (00:00:01:00:00:00), Dst: fe:ff:20:00:01:00 (fe:ff:20:00:01:00)
    Destination: fe:ff:20:00:01:00 (fe:ff:20:00:01:00)
    Source: Xerox_00:00:00 (00:00:01:00:00:00)
    Type: IPv4 (0x0800)
Internet Protocol Version 4, Src: 145.254.160.237, Dst: 65.208.228.223
Transmission Control Protocol, Src Port: 3372, Dst Port: 80, Seq: 480, Ack: 18366, Len: 0

No.     Time           Source                Destination           Protocol Length Info
     43 30.393704      65.208.228.223        145.254.160.237       TCP      54     80 → 3372 [ACK] Seq=18366 Ack=481 Win=6432 Len=0

Frame 43: 54 bytes on wire (432 bits), 54 bytes captured (432 bits)
Ethernet II, Src: fe:ff:20:00:01:00 (fe:ff:20:00:01:00), Dst: Xerox_00:00:00 (00:00:01:00:00:00)
    Destination: Xerox_00:00:00 (00:00:01:00:00:00)
    Source: fe:ff:20:00:01:00 (fe:ff:20:00:01:00)
    Type: IPv4 (0x0800)
Internet Protocol Version 4, Src: 65.208.228.223, Dst: 145.254.160.237
Transmission Control Protocol, Src Port: 80, Dst Port: 3372, Seq: 18366, Ack: 481, Len: 0
